timestamp,user,paper_id,review_type,section,point_index,point_text,rating
2025-12-08T23:54:24.393211,maitreya,fuBrcTH8NM,5_3,Summary,0,"This paper introduces a progressive training method for constructing model families, specifically targeting the efficient expansion of model sizes from smaller to larger. The approach, involving training models progressively, aims to reduce the overall computational costs and improve training efficiency compared to traditional independent training methods. The methodology leverages a range of experiments, including those on the LLaMA model family, to demonstrate the efficacy of this approach. The results highlight potential performance and cost benefits, although the paper's claims and experimental setups have been critiqued for their clarity and robustness. The method's effectiveness is debated, with concerns about its applicability across diverse model architectures and the generalizability of its findings.",Mostly Agree
2025-12-08T23:54:24.393224,maitreya,fuBrcTH8NM,5_3,Strengths,0,"The paper is clearly written, easy to understand, and provides a thorough analysis of the progressive training method across different model sizes, which is crucial for model scaling.",Mostly Agree
2025-12-08T23:54:24.393229,maitreya,fuBrcTH8NM,5_3,Strengths,1,The authors demonstrate the effectiveness of progressive training in terms of computational cost savings and comparable performance to independent training.,Completely Agree
2025-12-08T23:54:24.393234,maitreya,fuBrcTH8NM,5_3,Strengths,2,"The introduction of the concept of ""model expansion"" and ""progressive training"" as a novel approach in the field of model scaling.",Completely Agree
2025-12-08T23:54:24.393237,maitreya,fuBrcTH8NM,5_3,Strengths,3,"The paper includes a comprehensive set of experiments and analysis on the model family, specifically on the LLaMA model family, which supports the proposed methods.",Mostly Agree
2025-12-08T23:54:24.393240,maitreya,fuBrcTH8NM,5_3,Strengths,4,The findings on the consistency of the model family are intriguing and have implications for model deployment in real-world applications.,Completely Agree
2025-12-08T23:54:24.393243,maitreya,fuBrcTH8NM,5_3,Strengths,5,"The authors have made their code available, enhancing reproducibility and allowing for further exploration by the community.",Completely Agree
2025-12-08T23:54:24.393247,maitreya,fuBrcTH8NM,5_3,Weaknesses,0,"The paper lacks a rigorous experimental setup, with limited model architectures and parameter sizes tested, which may not fully support the claimed advantages of progressive training.",Mostly Agree
2025-12-08T23:54:24.393251,maitreya,fuBrcTH8NM,5_3,Weaknesses,1,"The scope of the study is somewhat narrow, focusing only on the LLaMA model family and a limited set of tasks. A broader range of tasks and model architectures could strengthen the findings.",Mostly Disagree
2025-12-08T23:54:24.393254,maitreya,fuBrcTH8NM,5_3,Weaknesses,2,"Some aspects of the paper, such as the experimental design and the interpretation of results, are unclear or not convincingly presented, which may affect the reliability of the conclusions.",Completely Disagree
2025-12-08T23:54:24.393257,maitreya,fuBrcTH8NM,5_3,Weaknesses,3,"The paper does not sufficiently address the potential limitations and challenges of the proposed method, particularly in terms of its applicability to different model families and its performance in high-resource settings.",Completely Disagree
2025-12-08T23:54:24.393260,maitreya,fuBrcTH8NM,5_3,Weaknesses,4,"There are concerns about the novelty of the proposed method, as it shares similarities with existing techniques like distillation and transfer learning.",Mostly Disagree
2025-12-08T23:54:24.393264,maitreya,fuBrcTH8NM,5_3,Questions,0,"Can the authors provide more details on how the progressive training method was implemented in their experiments? Specifically, how were the parameters of the smaller models used as initializations for the larger models?",Mostly Disagree
2025-12-08T23:54:24.393267,maitreya,fuBrcTH8NM,5_3,Questions,1,"Could the authors clarify the experimental design, particularly how the maximum learning rate was adjusted and the rationale behind this approach?",Mostly Disagree
2025-12-08T23:54:24.393270,maitreya,fuBrcTH8NM,5_3,Questions,2,How does the progressive training method compare with other model scaling techniques like LoRA or fine-tuning in terms of computational efficiency and performance?,Completely Agree
2025-12-08T23:54:24.393273,maitreya,fuBrcTH8NM,5_3,Questions,3,"What are the potential limitations of the progressive training method, especially when applied to different model families or in high-resource settings?",Mostly Agree
2025-12-08T23:54:24.393276,maitreya,fuBrcTH8NM,5_3,Questions,4,"How does the model family's performance change with varying degrees of model expansion, and how does this impact the overall performance and efficiency of the training process?",Completely Agree
2025-12-08T23:54:24.393279,maitreya,fuBrcTH8NM,5_3,Questions,5,"Could the authors discuss the implications of their findings on the consistency of model behavior across different sizes, and how this affects model deployment in practical scenarios?",Completely Agree
2025-12-08T23:54:24.393355,maitreya,fuBrcTH8NM,5_5,Summary,0,"The paper introduces a novel approach named ""progressive training"" aimed at training model families from smaller to larger models, thereby reducing the computational cost and enhancing model performance. This method leverages model expansion techniques and adjusts the learning rate based on model size, showing improvements in efficiency and performance over traditional independent training methods. The authors conducted extensive experiments to validate these claims, though the paper is criticized for its lack of clarity, insufficient experimental details, and inadequate comparison with existing methods. Furthermore, the paper's claims regarding the reduction in computational costs and model performance improvements are not convincingly substantiated by the data presented.",Completely Disagree
2025-12-08T23:54:24.393360,maitreya,fuBrcTH8NM,5_5,Strengths,0,The paper introduces a novel approach to model training that potentially reduces the total training cost of constructing a model family by up to 25% compared to training each model independently.,Completely Disagree
2025-12-08T23:54:24.393363,maitreya,fuBrcTH8NM,5_5,Strengths,1,"The proposed method is innovative as it uses model expansion techniques to incrementally train models from smaller to larger sizes, potentially offering a significant reduction in training time.",Completely Disagree
2025-12-08T23:54:24.393366,maitreya,fuBrcTH8NM,5_5,Strengths,2,"The paper is well-written and easy to understand, making complex concepts accessible to a broader audience.",Mostly Disagree
2025-12-08T23:54:24.393369,maitreya,fuBrcTH8NM,5_5,Strengths,3,"The method allows for more consistent behavior across different model sizes, which could be beneficial in various applications such as speculative decoding.",Completely Agree
2025-12-08T23:54:24.393373,maitreya,fuBrcTH8NM,5_5,Weaknesses,0,"The paper lacks sufficient details on experimental setups, including the specific model architectures, hyperparameters, and data used, making it difficult to replicate the results or understand the underlying mechanisms.",Completely Disagree
2025-12-08T23:54:24.393376,maitreya,fuBrcTH8NM,5_5,Weaknesses,1,"The claim that the progressive training method reduces computational costs by up to 25% is not convincingly supported by the data presented, and the paper does not provide a clear comparison to existing methods.",Completely Agree
2025-12-08T23:54:24.393379,maitreya,fuBrcTH8NM,5_5,Weaknesses,2,"The paper does not provide sufficient statistical evidence to support the claimed improvements in model performance, and the experiments are limited to a small number of model sizes (1B to 8B).",Mostly Agree
2025-12-08T23:54:24.393388,maitreya,fuBrcTH8NM,5_5,Weaknesses,3,"The writing quality could be improved, particularly in the introduction where the paper could benefit from more specific and detailed explanations of the contributions and motivations behind the proposed method.",Mostly Disagree
2025-12-08T23:54:24.393391,maitreya,fuBrcTH8NM,5_5,Weaknesses,4,"The paper does not address how the method scales to larger model families or how it performs on different types of tasks, which could limit its applicability and understanding of its effectiveness.",Mostly Agree
2025-12-08T23:54:24.393395,maitreya,fuBrcTH8NM,5_5,Questions,0,"Can the authors provide more details on the experimental setup, including the specific model architectures, hyperparameters, and data used, to help replicate the results?",Completely Agree
2025-12-08T23:54:24.393397,maitreya,fuBrcTH8NM,5_5,Questions,1,How does the proposed method compare to other existing methods in terms of computational cost reduction and model performance improvement?,Completely Agree
2025-12-08T23:54:24.393401,maitreya,fuBrcTH8NM,5_5,Questions,2,"Can the authors provide more statistical evidence to support the claimed improvements in model performance, such as confidence intervals or error bars?",Completely Agree
2025-12-08T23:54:24.393404,maitreya,fuBrcTH8NM,5_5,Questions,3,"How does the method perform on different types of tasks and larger model families, and what are the implications for its scalability and applicability?",Mostly Agree
2025-12-08T23:54:24.393406,maitreya,fuBrcTH8NM,5_5,Questions,4,"Could the authors clarify the writing quality issues mentioned, particularly in the introduction, and provide a more detailed explanation of the contributions and motivations behind the proposed method?",Mostly Disagree
